Review_text,extracted_aspects,inference_time
Its a must try buffet for any foodie. Awesome food with top notch hospitality. Highly recommend. Must visit place.,"food, hospitality, buffet",0.5349400043487549
"Excellent service,staff are very friendly and the food was delicious.Worth visiting.Everything was nice.","service,staff, food",0.4178459644317627
Kebab was excellent not only kebab but also others food was outstanding.Their environment was charming .,"Kebab, food, environment",0.5273051261901855
A lot of enjoyable and a great dinner experience with my family at Westin Dhaka is really recommended. Their variety of testy foods and nice staff's are really appreciated.,"dinner experience, staff's, foods",0.6530790328979492
Really great food items and service. Enjoyed the evening with family. The staff was very helpful and the food was top notch. Would definitely recommend to others.,"staff, food, food items, service",0.5870778560638428
"One of the best place to dine with friend and family everything was excellent, specially the world kebab was great.",world kebab,0.3576819896697998
"One of the best in Dhaka City.Kebab food excellent.Serbice was fantatic,environment so charming.excellent","Kebab food, Serbice, environment",0.7328033447265625
"I have been to this restaurant at least 50 times in last 10 years . One of our favorite places to eat when we want to spend $50 on a meal . I recently visited last Friday , had the lunch buffet which was extraordinary...More","lunch buffet, meal",0.47780632972717285
There have very delicious food collection .there have very tasty dessrt in here.their main dish is also very good.,"food collection, dessrt, main dish",0.6335411071777344
Thank you seasonal tastes for a great service and arrangements. We really enjoyed the lunch.. it's a big spread. We will come back again.,"service, lunch",0.2986180782318115
Terrific food.I had enjoyed all kinds of delicious and spicy. Specially desert & fish was awesome...,"food, desert, fish",0.418489933013916
A nice place to dine with business partner.Food was excellent.environment was wonderful.everything was nice,"Food, environment",0.35616374015808105
"Fantastic service by the westin dhaka seasonal tastes staff.foid was great,service was outstanding.nice","service, staff, foid",0.48721837997436523
Superb and delicious food.very have very gorgeous decoration also. We had lunch in here. It was very delicious food.,"food, decoration, lunch",0.48917341232299805
It was a outstanding lunch at westin dhaka seasonal tastes restaurant.Everythinf was fantastic.excellent.,lunch,0.23922443389892578
"Buffet at Seasonal Taste is delightful. There is a variety of cuisine, highly pleasant for all ages. The place is well maintained and the service is excellent. Would recommend.","Buffet, cuisine, place, service",0.6505799293518066
"Food was great, excellent service. However, the cheese section could have some improvement because the cheese collection was just as ordinary as other hotels.","Food, service, cheese section, cheese collection",0.6978435516357422
"Really good selection of food items! The quality of the food n service is exquisite! A must-try for those who enjoy a refreshing meal to relax in the weekend!! Even though I must admit, I like their breakfast better😜","quality of the food n service, meal",0.5947377681732178
We had a enjoyeble brunch in westin.this restaurant is very well decorated ND very delicious food in here.,"brunch, food, restaurant",0.47365856170654297
The Westin is very charming ND very luxurious hotel in this country. Their have very delicious food in here. We enjoyed our quality time to came here.,food,0.18647241592407227
"I do not usually eat at buffets but Westin taste breakfast I cannot resist. Very good egg station, huge varieties of items, juices, tea and coffee The staff provide good service as well!","buffets, egg station, staff, service, juices, tea, coffee, items",1.1897127628326416
The food was delicious and the service was awesome. I am really a very big fan of westin. Thanks for taking care of us. The kids zone was really wonderful.,"food, service, kids zone",0.4745759963989258
Options to choose from lots of verity. Number of food display table. I liked the Seafood part. Good quality food. Service excellent. Price is on high end.,"Options, food display table, Seafood, food, Service, Price",0.9504685401916504
The food is amazing. Specially they have many kinds of food which is most attractive I was enjoying their desert items Thanks service was good and specially rifa. Thank u,"food, service, desert items",0.477830171585083
Nice food quality Awesome environment And mostly high recommend Wanna come to again and again Thanks rifa..,"food quality, environment",0.35363078117370605
"Service was fantastic, loved their Japanese food section, main courses were ok, not great. Dessert was good, missed their tiramisu..","Service, Japanese food section, main courses, dessert, tiramisu",1.0913407802581787
"We went there with high hopes and glad it stood up-to our expectations. The restaurant “Seasonal Taste” at The Westin Hotel, Dhaka, offers buffet dinner, which includes variety of food choices including very sumptuous food-items such sushi, steaks, live kitchen for bbq etc. (most probably...More","food-items, sushi, steaks, live kitchen for bbq",1.1377403736114502
"Service is very good.the environment is very nice.some food so so everything was fantastic,excellent.","Service, environment, food",0.4127318859100342
"Outstanding lunch by westin dhaka,seasonal tastes restaurants associates.Everything was excellent.lovely.",lunch,0.24964475631713867
"Excellent service and dedication. Wide variety in cuisine. I actually noticed the difference in the variety of salads and presentation of foods , desserts and fruits from it was before. Foods tastes great too. Hope to get to see variety in future.","service, cuisine, salads, foods, desserts, fruits",0.9478025436401367
Westin have very delicious food items specially they have a good line of fish items and their dessert items are too good. We enjoyed our evening very much.service is excellent.,"food items, fish items, dessert items, service",0.7694604396820068
"Excellent service and attentive from reception to the waiter. We have great dine here. Restaurant always very clean and food quality is very good. The waiting staff are amazing, always friendly and ahead all my needs......","service, reception, waiter, food quality, waiting staff",0.8221466541290283
"Fantastic service, great food! We enjoy this evening very much.their food is awwome nd service is excellent","service, food",0.29949045181274414
Food was pretty good today. There are always a large range of food items. But I feel the quality has deteriorated since that of several years ago. Nonetheless service is still great,"Food, service, food items, quality",0.6552350521087646
In Westin there have very different type of delicious food .their sea food fish nd main dish is also very good.we love their dessert collection too.,"food, sea food fish, main dish, dessert collection",0.8089780807495117
Had a great time together with my family in seasonal taste.Everyone will enjoy it for sure.Hope everyone will like this place as i did.,noaspectterm,0.401583194732666
We had a great time to came here.their food is very tasty that's why we came here regular.their sea food fish and meat is very authentic and dessert is also very delicious too.we had enjoyed this moment.,"food, sea food fish, meat, dessert",0.7032670974731445
We had a great time in westin. Their have very authentic food in here.their dessert nd main dishes all are very delicious.,"food, dessert, main dishes",0.5295233726501465
Amazing environment to get together and have a meal. Their service is very amazed . Dessert is very tasty in this restaurant,"environment, service, dessert, meal",0.5940804481506348
Westin provides very authentic food nd delicious food also.we came in Thai festival in westin.their have very delicious food nd well decorated environment.,"food, food, environment",0.4129636287689209
"Excellent breakfast with a service with a smile. The staff anticipate your needs and it is a pleasant experience. The choices are across Arabian, South Indian and continental cuisine. There is a good selection of healthy options as well as for people with diet restrictions....More","staff, service, breakfast, choices, continental cuisine, Arabian, South Indian, healthy options, diet restrictions",1.5252928733825684
Food quality and taste was good. Beside their internal decorations and environment was extremely fine.,"Food quality, taste, decorations, environment",0.706716775894165
Great service by the Westin dhaka buffet restaurant staff.Food was excellent.Specially the grilled food was great.,"service, Food, grilled food",0.5228877067565918
The food and service quality is very good .we feel very good came to here.food is very tasty and service is excellent.,"food, service quality",0.3536961078643799
We come in first time in this restaurant. All food are very different and tasty. Every single item very testy.We enjoyed every items.,"food, items",0.30008840560913086
"Outstanding dinner at seasonal tastes restaurant.Service was excellent,environment eas awosom.lovely.","Service, environment, dinner",0.41866016387939453
"The service, food, ambiance and specially the people working here at the Hotel are great and amazing. Thank you for welcoming us.","service, food, ambiance, people",0.5941522121429443
"Really very good food. It was a great family get together. We just loved the masala tea. And rasgulla. Service was excellent and so natural, really enjoyed.","food, masala tea, rasgulla, Service",0.8239619731903076
"Dinner food was so delicious and environment and service person Mr.Al-amin was excellent, his behaviors was good.","Dinner food, environment, service person",0.5866942405700684
"I just fall in love with their sweet item called ""baklava"" this dasert made my face mouth watering... 🤗 As a first tym visitor I love their food","baklava, food, dessert",0.6755900382995605
One of the best food they offer us.. all the item is so delicious.. today their theme night is on. . Sea food theme night .. I also love their desert item.. specially the cake items.. so lovely.,"food, item, cake items, Sea food theme night",0.7594282627105713
Iam surprised to came here.Every single food item is very taste and delicious.Almost item are very different delicious.we enjoyed al most item.Hope we come again.,food item,0.24012494087219238
"Awsome food quality, service also great specially sagor and al amin was brilliant I have never seen before like this hospitality...it is best place to take your meal with family","food quality, service, meal",0.47594451904296875
"Food was awesome,brilliant service from sagor & Al amin,I have never seen before like this hospitality, keep it up..overal 10 out of 10","Food, service",0.4166736602783203
Aamzing collection of food. Great ambience and hospitable staffs. Even in buffet they serve most dishes on your table as per request :),"collection of food, ambience, staffs, dishes, table",0.8733420372009277
Seasonal tastes restaurant food was best in Dhaka city.service was outstanding .specially the grilled item was excellent.,"Seasonal tastes restaurant food, service, grilled item",0.8195748329162598
Westin dhaka seasonal tastes restaurant lunch was best in dhaka city.Everything was excellent.wonderful.,lunch,0.23698163032531738
"I stayed at the Westin for 10 days and never got bored with breakfast. Seasonal Tastes has a wonderful selection of food options from around the world, as well as incredibly friendly and service-oriented staff. Highly recommend!","food options, staff, breakfast",0.46636343002319336
"When I entered the hotel ,its make me astonished... It's really nice place for couple .. i am really happy to get that place to bring my wife and having wonderful launch.. the food is really delicious and service is awsome","place, food, service, launch",0.5259077548980713
Always good to be here. The environment is so Relaxing and their food & service is always top notch as usual.,"environment, food, service",0.4130864143371582
Nice environment place and good quality food or services.. We r astonished from there cause by they r opend new appayan centre is paan masala..that was fabulous. I ll never forget there delicious dessert..,"environment, food, services, dessert, pan masala",0.8207449913024902
Great items. Worthy of price.but food quality and service is really very good .we are feeling very good to came here .@sagor is very good server.this resturent is very good for quality time .,"food quality, service, server",0.47054409980773926
Very pleased with the consistent service and the excellent food. This location never seizes to amaze.,"service, food",0.29576754570007324
"Great spread for lunch. Across local, international and even sushi as well!! The mangoes were brilliant and so were the deserts","spread, mangoes, deserts, lunch",0.7554047107696533
"If I intend to have a delicious gourmet buffet, I always book my table at ST, next would be Latest Recipe at Le Meridian. Surely, in terms of menu, taste and ambiance ST is unbeatable at Dhaka. Though hard on your wallet, B1G1 offers are...More","menu, taste, ambiance",0.46912312507629395
Wow..What An amazing lunch experience we just had in Tastes restaurant. Their food and service is just top of anything. Restaurant ambiance is great for family and service staff were very much helpful and experienced. Thanks Westin Dhaka for making our day👍,"food, service, ambiance, staff",0.5830821990966797
"We always go out to dine at this places & normally more than couple of times during the Ramadhan for Iftaar. It’s always nice to have meal over at Taste. Such a wide variety of food is served, really difficult to choose.","meal, food, served",0.47374939918518066
All the foods were fresh and tasty. Very good quality and awesome taste I think I’ll come here again and again Thanks,"foods, quality, taste",0.47131943702697754
Thank you for service. Tasty food Happy spending time Lovely environment Wanna came here again Thanks westin,"service, food, environment",0.41354894638061523
The food was excellent and desserts were delicious. Wish to come again in next Ramadan. Thanks rifa Mahbub GM X Index Group,"food, desserts",0.35643839836120605
Food here is very good... Best for its price.... Good environment Getting Nice behaviour from all And sweets are very tasty Thanks,"Food, price, environment, sweets, behaviour",0.7713229656219482
This place has a wonderfull environment. There is a wide variety of choices to choose from and the food is very good...,"environment, food, choices",0.4252147674560547
Awesome food as always Specially Nehari i like this most They have many items here. Amazing arrangement thanks,"food, Nehari",0.4233877658843994
city best iftar item lovely environment specifically malai tea Turkish sweets are awesome .. good service as well thanks,"city, iftar item, environment, malai tea, Turkish sweets, service",1.120152235031128
This is a restaurant located on 2nd floor of hotel Westin in Dhaka. The decor is unusual and food variety is awesome. The buffet is worth a try and is priced reasonably. The choices are ample and the staff is efficient. Overall a trip worth...More,"decor, buffet, food variety, staff, priced",0.8340966701507568
I think that is the best iftar I ever had Food is awesome but service not good They are little bit rude,"Food, service",0.35482072830200195
Baby sitter room must be needed They don’t have any baby feeding room I m just disappointed for that Really its not expecting from westin dhaka,"baby sitter room, baby feeding room",0.6539013385772705
It was an wonderful experience having a family ifter... food was delicious.. service was ok compared with a huge crowd situation .. I will recommend others to join ifter in the coming days . Thanks Rifa for being us very nicely,"food, service, ifter",0.46689629554748535
Best iftar in Dhaka city Seasonal taste is best in all foods. Thay have asian amarican food also Btw today we were having iftar here it was nice,"foods, iftar",0.41341066360473633
"Been coming to their Iftar/dinner for the past few years-hasn't let me down even once! Consistent quality, taste and service!","Iftar/dinner, quality, taste, service",0.8143699169158936
The iftaar buffet was elaborate and delicious. Loved it. Thanks westin dhaka for making this type of restaurant Great iftar experience,iftar buffet,0.3546433448791504
We came here for having iftar They are always best in food and services Lovely environment and lovely people thank u,"food, services, environment, people",0.528303861618042
They are always best in food Awesome Iftar I ever had but today we didn’t getting the service which one we were expecting from them Anyway I think service should be more good like a 5 star thank you,"food, service",0.29533958435058594
It is one of the best experiences i have had in bangladesh. Love the food and the ambience. Definately will come back again.,"food, ambience",0.3640000820159912
I have always enjoyed the Iftar at the Seasonal Taste. Wide range of culinary delights. Good food! Great staff!,"food, staff, culinary delights",0.5987074375152588
Best iftar items Food quality is best Lovely service And lovely decoration Thanks westin dhaka And thanks to seasonal taste,"Food quality, service, decoration",0.6054275035858154
Best food Best quality Good environment Lovely place Awesome service Thanks Westin dhaka for making THIS type of restaurant,"food, quality, environment, service",0.5275692939758301
Foods are very much testy. But there is an option to improve arrangement of foods along with foods of live station.,"Foods, foods of live station",0.5900583267211914
Too much tasty food and different food I m just confused what should i first having T Lovely envoronment,"food, food",0.3148195743560791
"Food quality , variation & taste is very good. Service & decoration excellent... awesome decoration lovely place thanks rifa","Food quality , variation , taste, Service , decoration",0.8453483581542969
Best taste Awesome and ymmumy food Love their behaviour And awesome environment Wanna come here again,"food, behaviour, environment",0.4147334098815918
"I had been to their restaurant during their iftar, to try on different varieties of it but unfortunately i felt like I was kinda overlooked... I mean i am a non-muslim and went to try out something new, to enjoy the ambience of it. Well...More",ambience,0.2460033893585205
"Most of the dishes are really tasty and healthy, beautifully presented and decorated. The salad bar is unique, the Sushi bar needs improvements, the Haleem needs some improvement, awesome dessert menue great Tandoori Roti and Chicken, superb lamb leg rost.Great ambience very friendly female hosts...More","dishes, salad bar, Sushi bar, Haleem, dessert menue, Tandoori Roti and Chicken, lamb leg rost, ambience, hosts",2.3938121795654297
Best buffet resturent Lovely environment Awesome service And nice place Hope will come here agani Thanks,"buffet, environment, service, place",0.597928524017334
We really enjoyed here We come here to having iftar They are awesome in every food Thanks for making awesomeness for us,food,0.1894698143005371
Good varied menu. Excellent service. Everyone very attentive. Good afternoon idea to introduce lactose free tea. So I requested to Rifa please inform your manager for take some steps about lactose free tea thanks,"menu, service, lactose free tea, manager",0.7606585025787354
Good place and good food. Good range of foods available. Awesome food tast Nice decorations And very good service,"food, foods, decorations, service",0.598109245300293
Excellent food for ifter and dinner. Items are very good. Each items are extremely delicious. The juices are very refreshing. The place is very cozy.,"food, items, juices, place",0.5821733474731445
First of all I Love there decorations Awesome food specially Arabian kabab muttun halim this was great and surprising Hilsa fish Thanks Westin dhaka thanks rifa,"decorations, food, Arabian kabab muttun halim, Hilsa fish",1.2362422943115234
"Excellent arrangement by the authority & nee chef, special acknowledgement for your vibrant team who attended each customer with utmost care. Lovely ambience with scrumptious food! Thanks rifa for attending us","chef, ambience, food",0.5308704376220703
It was good. But could have increased the number of dishes. There was not a good number of variety to go with. But overall it was good.,"dishes, variety",0.35592126846313477
Best Indian food And others food like ASIAN Americans bangali foods are also very tasty Thanks to westin Dhaka,"Indian food, foods",0.4115917682647705
Great food.. specially their desert section is best in the city. totally a value for money for me. people must try..,"food, desert section",0.3544754981994629
Today we having Iftar here The world best food item Love there Iftar item Good service Awesome decoration,"food item, service, decoration, Iftar",0.7518429756164551
it was a great hangout at the restaurant..a bid spread. and really friendly behaviour of the service personel. we really enjoyed it.. thank you westin ..,"service personel, spread",0.4087510108947754
It was a great experience ideed. Foods and environment was outstanding. I must appreciate the entire setup. Cheers..,"Foods, environment",0.4733090400695801
Just love their foods always Seriously they know about the magic of taste All kinds of food made here Thanks Westin to making this type of restaurant Thanks rifa for make us feel special,foods,0.25096583366394043
Best buffet restaurant in dhaka city Awesome Indian food Sweets are also very good Fantastic service Thanks westin and Rifa is very helpful . Thank you,"Indian food, service, sweets",0.5906581878662109
Food full of flavour and the BEST desserts in Dhaka. The grill corner is my personal favourite - I never miss the sea food grill there. The Mango cheesecake has also been one of the best desserts that I have tried.,"Food, desserts, sea food grill, Mango cheesecake",1.1038551330566406
They are always famous for tasty and yummy food.. They make Indian Asian American and Bangladeshi food also Love their good service Love their environment. And specially Rifat is very good she is attentive.. And careful. Thanks,"food, service, environment",0.4339637756347656
It’s a very nice place. Foods are good. Shushi and salads are yummy. I liked their desrets too much. Environment is good. Service is good.,"Foods, salads, desrets, Environment, Service",0.9003322124481201
Everything is good .Their food is too good . Best buffet restaurant in Dhaka city Today we reserve a party in this restaurant they made excellent food for us And service r too good,"food, service, buffet",0.47075748443603516
we are coming here to spending a good time.. we all feel very satisfied here allover is very good like food service all things love their environment thanks.rifa ro much friendly behavior. I like it....,"food, service, environment",0.44600796699523926
"All items are good, fresh , healthy,and teasty I really appreciate to seasonal taste for best food forever Asian all typs of food available here Thanks","food, Asian food",0.3617386817932129
Good Buffet restaurant Best food Spending a awesome time here with my family Love their service Thanks to westin,"food, service, Buffet",0.5193557739257812
Thw food served was amazing with the ambience followed. The service given by the employees are 10/10. Made a prefect choice taking seasonal taste. The food : 10/10,"food, ambience, service, food",0.5931546688079834
I really like the food taste and quality. Moreover the ambience is wonderful. But it would be great if you could bring variation in sushi menu like baked ot torched.,"food taste, quality, ambience, sushi menu, baked ot torched",1.1981515884399414
It was a pleaser to do dinner at western. The food quality was very good and Unique and environment was awesome specialy service was good,"food quality, dinner, service, environment",0.5852153301239014
"Nice buffet at westin dhaka seasonal tastes restaurant.everything was excellent.service,food,embience excellent","buffet, service, food, embience",0.644207239151001
I had the lunch buffet and there was and abundance of choice. From Bangladeshi cuisine to sushi and most of it is pretty authentic. The salad bar is amazing and not a typical salad bar at all. But the desserts are truly the best. As...More,"lunch buffet, Bangladeshi cuisine, sushi, salad bar, desserts",1.279918909072876
They are famous always for the best buffet food in Dhaka city They seriously made the awesome food as well Good service and environment,"buffet food, service, environment, food",0.656670093536377
"The best restaurant is seasonal taste I visit here .Very nice place of Dhaka city .there food are just too yummy specially beef steak,Indian food all,and dessert also.they are so kind and celebrated my husbands birthday ,also very helpful Mim because she kept my baby...More","food, beef steak, Indian food, dessert",0.7601878643035889
I m just surprised that it was my birthday and they didn't know after that knowing wish me greatfully.i m just amazed about their services and food quality with good taste.and very glad to came here it was brunch section. We got some people there...More,"services, food quality, taste, brunch section",0.7120070457458496
Especially i want to say here's Beef steak was so much yummy i just like it.All food also gd taste by i just love their steak 😘.there sweet item collection is huge.they are service also friendly and caring.Mim and Arif just helped us to get...More,"food, Beef steak, sweet item collection, service",0.8123674392700195
