Review_text,extracted_aspects,inference_time
Had an amazing dinner with family. Today our special day . It was great dayThe staff were amazingly friendly. Made our special night very special. Thank you.,"staff, dinner",0.3107137680053711
Tonight dinner was wonderful dinner. I went my full family to enjoy our dinner. Food taste 💯/ 💯. All over excellent. Service was very good.,"dinner, food, Service",0.4935572147369385
Wide spread of buffet dinner. Really enjoyed it with our whole family. Delicious. My favourite place in Dhaka city. Thanks to all of you.,buffet dinner,0.30924463272094727
Food at Seasonal taste was really delicious. Particularly the dessert section. Really enjoyed it. Service was excillent,"Food, dessert section, Service",0.6311824321746826
It was a great experience considering both the food and ambience. Top notch service. Hope to come again... Thank you 😍😍😍,"food, ambience, service",0.4868052005767822
"Very good service, friendly & helpful staffs. Good was great 👍🏼 Family loved the experience. Would love to visit again Insha Allah","service, staffs, was",0.4935159683227539
The food is really fresh and good.....the ambience is really nice...the staffs are also very friendly..definitely a 5 start,"food, ambience, staffs",0.5467326641082764
Service has been top notch over the years. The food is exceptional. The rooms are clean. Very excellent service. Thanks,"Service, food, rooms, service",0.5570931434631348
"Very gentle environment, good food, relaxing Interior space. Everyone service was excellent. Service also. Staff are very polite","Environment, food, Service, Staff",0.5462050437927246
The food was pretty Delightful. Loved the environment and service. Well organinized. Thanks to all & seasonal tastes.,"food, environment, service",0.4324636459350586
A great place for a family dinner with a wide variety of items and an amazing atmosphere . Food was amazing. Service was excellent. Thanks to all,"atmosphere, Food, Service, dinner",0.6625494956970215
"Awesome place and delicious food. Cozy for kids too !! Every staff are very friendly, excellent service. Specially thanks to all staff","staff, service, food, place",0.5761537551879883
Every food was amazing. Every staff are very friendly and polite. Very good environment. Specially thanks to Ms Nahar. She is very friendly,"food, staff, environment",0.42888832092285156
"Food was good , table location was strategic and alot of effort in making our dinner meeting with partners fruitful. Manager was great and Ms Nahar was helpful and attentive to all our request on the table.","Food, Manager, table location, Ms Nahar",0.7930953502655029
Excellent food and atmosphere. We will be there again to crave this foods. Highly recommended for food lovers . Thank you to all off you.,"food, atmosphere, foods",0.42076539993286133
"Westin is the best hotel at dhaka city. We all are just loved this place. There food, staff behaviour all excellent. Thank you to all of you.","food, staff behaviour",0.3630249500274658
Today we did our business meeting at seasonal taste is was a wonderful brunch. There food was yummy and delicious. All people behavior is excellent. I m so happy .,"brunch, food",0.36889004707336426
The food is vary taste and well cooked.we like it and hope we will come in again so soon. Everyone service was excellent. 🥰,"food, service",0.3249478340148926
"One of the best services I got from any restaurant, food quality is super great as well.Would recommend anyone to come and visit","services, food quality",0.3620901107788086
Both the food and service quality was very good and the hygiene was perfectly maintained....and the interior was well decorated..,"food, service quality, hygiene, interior",0.717700719833374
Excellent service. Every food is very delicious. Environment also amazing. Thanks to ms Nahar. She is very helpful. Rafiq is very proactive,"service, food, environment",0.428539514541626
First of All Food quality very good .I think next also maintain also this quality .If some inrease Food item Is also good for us .Best wishes,Food quality,0.3101201057434082
"Great service and food. Every food is very delicious, environment is very wonderful. All staff are very friendly, specially thanks to Ms Nahar. And rofiqe is very friendly","service, food, staff",0.4342079162597656
exelent bruch! service was excellent too. Nahar our special hostness was very courtious n very attendtive..good luck.,"bruch, service, hostness",0.5393679141998291
Celebrating International Mother Language Day at the Westin Dhaka with their amazing buffer lunch. Highly recommended for anyone visiting this part of the town.,buffer lunch,0.25153446197509766
"The environment food quality is excellent. Every Staff are very friendly, polite. Every food quality is best food quality in buffet","environment, food quality, Staff, food",0.6026806831359863
I liked the ambience and the attitude of the stuff. Nahar has specially assisted us and helped us. She has a good personality and is charming. We are delighted and will come again.,"ambience, stuff, personality",0.4912075996398926
"Alhamdulillah, great ambience with extraordinary taste and standard of food except some items of fish. Simple menus came up with unexplored taste. Obviously the staff were so cordial.","ambience, taste, staff, menus, fish",0.7747399806976318
Everything was very good and fine.Specially service was awesome and so cordial beyond the expectations.thanks ms ishrat.,service,0.1882646083831787
"The food is really fresh and good..also great service..good behavior. There food also very yummy. Specially tempura, Desert very delicious","food, service, tempura, Desert",0.6626052856445312
Very Excellent service and food. Again we will visit for the excellent service. Food was amazing just like breath taking.,"service, food",0.31407618522644043
Such an Excellent environment for family and testy food of course. Nice cooperation and friendly behavior have all staff. Thanks,"environment, staff, food",0.4232625961303711
I have been coming to Westin for a very long time. Love their service and food quality is out of the world.specifically thanks to Ms Nahar & Rofiq. Best buffet in the city for sure!♥️❤️,"service, food quality, buffet",0.5507194995880127
One of the best buffets i have had in Dhaka.. The ambience was pretty good too and so was the service Definitely recommended.,"buffets, ambience, service",0.5571320056915283
"The hospitality was delightful. Loved the food especially the kebab. The appetiser was good, hopping to be here soon again!","hospitality, food, appetiser",0.6214940547943115
"Westin Dhaka's buffet offers diverse, high-quality dishes in a luxurious setting, with standout foods and desserts.","dishes, setting, foods, desserts",0.6638729572296143
"Exilent hospitale great food test . All food are delicious and all staff are really nice and also there service. Dessert, shushi, shashimi was excellent.and also thanks ms. Falguni for her hospitality","hospitale, food, staff, dessert, shushi, shashimi",1.3695497512817383
Ms. Falguni was perfect. Thank you for your service. The time was very early like 6.00 am but Ms. Falguni was always posstive and had smiliy face.,service,0.18741440773010254
Really amazing taste with great and honourable hospitality . Their service was excellent 👌. This is my first time there. Wonderful restaurant 😍🥰,"service, taste, hospitality",0.4806537628173828
Food is awesome and very delicious with a very decent hospitality really amazed. I went today for my special day😍 really enjoyed this day,"Food, hospitality",0.4288334846496582
Food was sumptuous. Service is excellent. It was a family gathering and we really enjoyed the food as well as the cozy environment.,"Food, Service, environment",0.4790184497833252
We are very happy to have a nice dinner here. Service was excellent. Food quality was one of the best buffet in Bangladesh.,"Service, dinner, food quality, buffet",0.6556079387664795
"Its a Great experience Really it will be memorable Birthday, All stuff was cordial FEROZ, SAGOR,FALGUNI, SHANTA APU ND Bhaias best, Thanks A lot , I will come again IA Best wishes,,",noaspectterm,0.36511826515197754
Today is my wife birthday . Its a special day for us . There all person are make my day very special they cut a cake for my wife . All food & service is excellent i m so happy .,"person, food, service, cake",0.5375242233276367
I m regular person . They are just wow....there food is yummy than others pleace. I just loved there food ....service is excelent. Best hotel in dhaka.,"food, service",0.3017919063568115
The food was really good and so was the service. Five stars! Loved the variation in cuisines. Would recommend to everyone.,"food, service, cuisines",0.5403914451599121
"Very nice buffet dinner arranged, excellent service, specially thanks Ms. Nahar, staff are very friendly. Regards Rony","buffet dinner, service, staff",0.5386180877685547
"In one word ""Splendid"". Food tastes in heavenly per se. Everything is excellent, service also great , specially in brunch.","Food, service, brunch",0.5490481853485107
"The food was really good with there being a range of cuisines to choose from. The dessert section was filled with tarts, cakes and ice creams which were the best way to end the meal.","food, dessert section, tarts, cakes, ice creams, meal",1.1298892498016357
Excellent food and service 👌 seasonal taste restaurant. We are happy. Staff behavior just good 👍 special thanks Ms Ishrat very nice person and very helpful 😊,"food, service, Staff behavior",0.49141669273376465
Food is too much good. Nihari was fantastic. Service was too much good.we are always enjoying Westin first class service. I think they are the number one five star hotels in Bangladesh. Best wishes for them. Sharan is very humble. He serve us very well,"Food, Service, Service, hotels",0.594341516494751
"The food and the service is great! Thanks sharan, Clinton. We had a grate time with Arabic food kebab & dessert. Environment is good","food, service, Arabic food kebab & dessert, Environment",1.0224878787994385
"Seasonal taste is amazing today vs. usual Friday ( we were here today 09/02/24). The valentine decorations, very caring & courteous team of Hotel officials and staffs. And all the food was just fresh from the oven …loved it even more today with our guests...More","valentine decorations, food",0.5865514278411865
"Dining in Westin is always a great experience. Mouth watering food, awesome service n great ambience. Every staff is very friendly","food, service, ambience, staff",0.5981705188751221
Had a blast with my best friend for sure . Service is good. food is best good quality. Staf is very friendly. Best buffet in Bangladesh,"Service, food, staf, buffet",0.6589882373809814
"Together buffet lunch at westin Dhaka , seasonal taste restaurant 😍 all food very yummy this is 3rd time I went there. All about just excellent 👌👌👌",food,0.2010655403137207
Everything was good. But the menu was better before than this time. I would suggest add some more soup options. Other then that everything was amazing,"menu, soup options",0.3939528465270996
"Yes, it is a great place to go out with my family. We really enjoyed the food. Service is very excellent, Every staff is friendly .","food, Service, staff",0.4279134273529053
"This is really wonderful experience. We went together for lunch at seasonal taste, The Westin Dhaka. All food just yummy. Specially main Course is so delicious 🤤🤤🤤. Specially thanks to mr.Shakhawat for invitation","food, lunch, main Course",0.5143332481384277
Is was a very nice day & lunch also at Westin Dhaka. All food was delicious and so yummy 🥰all good 👍🏽 bc bc……………………………..,"food, lunch",0.3054924011230469
Today we went seasonal taste restaurant for our business meeting... We are so happy for there service. Just wow❤️ food tast 100/100👌 all are so kind. Everything is excellent 👌💯,"service, food, taste",0.42108774185180664
Today we went for Brunch. Breakfast plus lunch. Amazing choice of delicious food along with 3 fresh tasty juice. Top notch custom service from all staff. Also we got complimentary pool access which was an added bonus. Will definitely recommend everyone to visit.,"food, juice, service, staff, pool access",0.7398064136505127
"We tried like all the buffet restaurant in Bangladesh,but westin buffet is best of best. Super food & service. Staff are really well trained Sharan & Clinton serve us very well ..we all love westin food always","food, service, staff",0.418806791305542
Food is great in general. Would have loved the sushi to be a bit more fresh. The sushi rice fell a bit stale in comparison.,"Food, sushi, sushi rice",0.7927093505859375
Their food was very fresh and tasty. I often have lunch here with my family and friends. Their behavior was also very good.,"food, lunch",0.30165791511535645
Its been a great experience. Food was lovely and the ambience was too. But the most commendable of them all would be their top notch service and food quality. Absolute banger. Would recommend to all.,"Food, ambience, service, food quality",0.7147026062011719
"Everything's was Perfect. Attentive service. Food are so delicious. Staff r so friendly and helpful , Recommend .*****","service, food, Staff",0.44395017623901367
The foood and everything was very good Saron and falguni their behaviour was also good and very kind Will come here again. Highly recommended,"foood, behaviour",0.3652808666229248
"Just went to the Westin dhaka for brunch, the food, ambience and the service was pretty amazing. The staffs were very welcoming specially Ms Falguni. Hoping to visit here soon.","food, ambience, service, staffs",0.654658317565918
Overall it is good. But I will recommend to taste to biriyani its too good. Highly recommended thanks falguni,biriyani,0.36115527153015137
Nice environment. Food quality is very good. Staff are very friendly. Mr nikson & rafique is very good. Thank for a nice dinner.,"environment, Food quality, Staff, dinner",0.6370007991790771
The foods are very tasty and delicious specially the continental. The hospitality the receive are amazing.,"foods, continental, hospitality",0.5902419090270996
"everybodys service is excillence, Food was amazing and the surprise they gave me was quite impressive. Worth it.","service, Food",0.29895997047424316
"This place is nice to hang out and food also. I like sushi, oriental food, dessert and live cooking foods. The place is cool indeed.","sushi, oriental food, dessert, live cooking foods, place",1.110337734222412
"Great atmosphere , delicious food, we had a mutton rezala .. Which is really delicious .. Sweety is very kind & giving us wonderfull service . Thanks falguni and sagor","atmosphere , food, service",0.5407845973968506
Seasonal tastes is best restaurant in Dhaka city. Good food best service.Really we enjoyed here. Very nice environment. Thanks falguni and sagor. We will come again….,"food, service, environment",0.44344186782836914
Seasonal taste Best restaurant..... delicious food. Grilled and matun nehari Best..... Service just excellent Staff good behaviour thanks,"food, Service, Staff",0.4160346984863281
"The food that they serve are in very high quality which is undeniably satisfactory. On the the contrary, it is also quite delicious.","food, food",0.31983470916748047
"I explain my todays lunch experience.... It was an Awesome experience... I went there with my mom,kids, & husband.... So beautiful Place i love this. All food is just wow..... All staff are so friendly.....","Place, food, staff",0.41347455978393555
"Westin brunch, is best brunch i ever seen. It's wonderful always. I love this place. Food quality Just wow. Service experience 👌👌👌👌","brunch, Food quality, Service",0.561457633972168
Its our family time with my wife & baby boy. We are very happy to spent our quality time at Westin dhaka. Special thanks all Staff they are superb. 👌👌👌,Staff,0.2479724884033203
I went today in seasonal taste restaurant....And I have a awesome experience.. & next time I will go there with my friends... All food & staff are very friendly and helpful. Service experience is wowww..👌👌👌,"food, staff, Service",0.4843623638153076
Today enjoying my lunch with my family member. Its really wonderful time. I really highly appreciate all Staff. They are really very friendly. All food yummy... Thanks to all.,"Staff, food, lunch",0.5091900825500488
The food quality and variety of items are excellent . Service is as usual up to the mark . Best buffet resturent in Bangladesh . Recommended place for family dinner and specially with foreign guest ….,"food quality, variety of items, Service, buffet",0.7817652225494385
From the greeting step everything is perfect. food and service is up to the mark.all staff r super friendly.,"greeting, food, service, staff",0.6054034233093262
We enjoyed a lot the Buffet food r so delicious staff r friendly and helpful. 5 star service*****. recommended,"Buffet food, staff, service",0.5356433391571045
"Impeccable service, luxurious amenities, and attention to detail made my stay at the 5-star hotel truly exceptional. The staff went above and beyond to ensure a memorable experience. Every aspect, from the elegant decor to the gourmet dining, exceeded my expectations. A truly indulgent escape.","service, staff, decor, dining",0.5391256809234619
Very nice moment....i enjoying my time with my brother . Seasonal taste food review just awsome. All are providing me a great service. All over its a beautiful & enjoybale day for me,"food, service",0.3022146224975586
Today I went westin Dhaka to haveing my lunch with my wife . Today our anniversary & we spent our quality time . It’s really very memorable. All staff are very friendly. Thanks to all of you. 🤝😍,staff,0.1854100227355957
Great food with a calm ambience. We were well attended to and had a good experience overall. I particularly liked the sushis and the salads. The desserts were amazing as well .,"food, ambience, sushis, salads, desserts",0.9638340473175049
The environment is well.Good service.Food is well.Highly recommended .mutton nihari was very best . Highly recommend.and falguni,"environment, service, food, mutton nihari, falguni",1.0288927555084229
"It was amazing a lot of choices clean and delicious, specially Ms. Falguni and she do very nice service and she is so helpful , thanks a lot for hospitality and warm welcoming,","service, Ms. Falguni",0.5427472591400146
Seasonal taste restaurant we get yummy foods.tempura as always wonderful.service as always very good.. ..... very friendly ishrat thanks everyone,"foods, tempura, service",0.5392515659332275
"Seasonal taste best of food. I love Grilled items. Mutton nihari, and cheese cake Just wow. Service was good. Thanks everyone Staff behaviour good.","food, Service, Staff behaviour, Mutton nihari, cheese cake",1.0044190883636475
The environment was good food was fresh..excellent service all over good…….perfect buffet lunch lot’s of food…..,"environment, food, service, buffet lunch, food",0.7775471210479736
Best of seasonal tastes restaurant. Service great. Food quality Very good..... Special Thanks ms Ishrat thanks........ 💕💕,"Service, Food quality",0.35726308822631836
Today I went with my wife in seasonal taste for brunch. Really it's a great experience. My wife is so happy to a great service. Food is excellent 👌. Thanks for the support ❤️,"service, Food",0.2998349666595459
"At Seasonal tastes restaurant we get yummy foods. Their live cooking grilled, dessert, various cuisine main courses also enjoyed our dinning experience.","foods, live cooking grilled, dessert, main courses, dinning experience",1.128674030303955
The service and food was amazing. Just 10/10. The people are also good and amazing behaviour. A must go with your dear falguni,"service, food",0.2991621494293213
"Specially soup is so yummy for me. Tempura as always wonderful. Desert , nehari, & juice is fresh just wow. Service as always very good to all","soup, Tempura, desert, nehari, juice, Service",1.0105609893798828
Overall a great experience. The food can get better. Otherwise everything is fine. And the behaviour of the staffs are very good. They are well behaved.,"food, staffs",0.3665921688079834
"Nice environment with good, really delicious the food really enjoying, wanna go with my family again, specially complementary swimming was awesome.","environment, food, swimming",0.4202301502227783
Absolutely amazing food great place and service. Mr. Rubel and Mr. Sagar are excellent at their job.,"food, place, service",0.41792869567871094
This is a awesome lunch with some friends 🥰 lovely day at seasonal taste. Food is really very yammy. Service quality is jst wow. All people are very good & giving me great service. Thank you so much.,"lunch, Food, Service, Service quality",0.6811118125915527
I went the seasonal taste in westin Dhaka. It was a wonderful lunch today. Specially beef section is very yammy. Food & service are good. Thanks to all of you.,"Food, service, beef section, lunch",0.6546046733856201
Food quality is very good. Specially ice cream peanut butter flaver. Services is very good. All stuff very friendly.,"Food quality, ice cream peanut butter flaver, Services, stuff",1.09507155418396
"Tastes restaurant is always my first choice intire Dhaka. I usually come here for meeting, ms Jannat and ms Shanta are the best server I have ever seen . My foreign clients are also very much happy with their service","server, service",0.32354164123535156
Best of seasonal 👌 taste restaurant. I loved food 😋 service was great 👍 Ms ishrat very helpful thanks 😊.....,"food, service",0.29956889152526855
It is a very nice place for dinning. The staff are very friendly with us.They always assist to their food .my over all experience is outstanding.,"staff, food, place",0.41091227531433105
Great food and ambience. A wonderful dining experience thanks to Mr. Krishna's hospitality. The servicessape is worth applauding.,"food, ambience, servicessape",0.6642296314239502
Quality of foods and serving are excellent. Maintaing cleanness and hygine is quite satisfactory. I am pleased.,"Quality of foods, serving, cleanness, hygine",0.9638504981994629
Each and every item was just outstanding. The fish and prawn were the best I have ever tried. Highly recommend it. Great service by Krishna,"fish, prawn, service",0.4763920307159424
I went seasonal taste with my friends 😍 all food in very good . Service quality is just awesome 😍 they giving me wonderful service.. thanks all❤️,"food, Service quality",0.36171793937683105
Atmosphere was amazing.. got live cookings station. food was fresh and taste and staff was friendly. Will be back for sure.,"Atmosphere, live cookings station, food, staff",0.8579258918762207
Taste is the best restaurant I often visit with my family My kids love their brunch so much their swimming pool is so wide my kids love this I really like that,brunch,0.24070477485656738
Seasonal taste provide a best buffet in city. Also they have best swimming pool in dhaka. We really like their food and service. Shahin and nikson is a great server and ms jannat is very welcoming,"food, service, server, swimming pool",0.5992648601531982
Seasonal taste restaurant is always in my first priority. Specially their live kitchen is just wow for us and dessert area is just best item they served. We really enjoy our brunch,"live kitchen, dessert area, brunch",0.6567583084106445
"Krishna has been wonderful for every meal we had at Seasonal Tastes. His service is top notch, as well done as the food :) Will definitely visit again!","service, food, meal",0.434406042098999
Hilsha feast was very good. Environment and behavior was excellent. Other food special deserts were fantastic.,"Hilsha feast, food special deserts, Environment, behavior",0.9459831714630127
One of the most memorable restaurant experience of my life! We had dinner .Food was all round amazing. They treat the house like family. Everything we enjoyed.,"dinner, Food",0.35732364654541016
"I explain my buffet lunch experience . Its really awesome. I will come back again & again. Food quality, service quality everything are very good. ☺️💜 specially desert is nice 🤩 thanks to all of you.","Food quality, service quality, desert",0.6031506061553955
"I m regular guest in seasonal taste. Today I come with my family. It was an wonderful experience. 😍😍 Specially desert.prawn, fish are very good . Test quality good. Service quality is very good. Thanks to all of you.❤️","prawn, fish, Service quality, desert, Test quality",0.8382413387298584
"Today excellent lunch i have. Every food quality are very nice. Prawn tempura, fish etc are awesome. Services experience is really good. Specially thank to all service stuff But we need soft drinks including in Buffett. Thanks","food quality, fish, Services, service stuff, soft drinks, Buffett",1.0732977390289307
"The lunch was amazing loved the experience,Ishrat mam was amazing person to here her aura was amazing",lunch,0.24972105026245117
Seasonal tastes restaurant best buffet Brunch. I like fish kofta. And kebab... Brunch special care Ishrat good service all good nice food i will come Again thanks...,"fish kofta, kebab, Brunch special, service, food",1.0607647895812988
Great for the brunch.Best restaurant seasonal taste .excellent dessert 👍 food are good and Ishrat is so excellent service very much well behave thanks .,"brunch, food, dessert, service",0.6655147075653076
"Best restaurant seasonal tastes.excellent service ,food quality good 😊 so we are happy grilled items ,fresh fish 🐠 I like dessert 🍨 .ms Ishrat wonderful service very friendly thanks .","service ,food quality ,dessert ,grilled items ,fresh fish",0.9992396831512451
